Id,Date,Text,Combined
1765,9.16.2015,Steve Patterson we have a seat here for you that will be $75,9.16.2015  Steve Patterson we have a seat here for you that will be $75
1766,9.14.2015,I like my cheese like I like my men,9.14.2015  I like my cheese like I like my men
1767,9.10.2015,NFL is finally here and our Chimis are not deflated,9.10.2015  NFL is finally here and our Chimis are not deflated
1768,9.9.2015,Hot out there! Cool down with our frozen margarita,9.9.2015  Hot out there! Cool down with our frozen margarita
1769,9.8.2015,I need a three day weekend after my three day weekend,9.8.2015  I need a three day weekend after my three day weekend
1770,9.4.2015,Abdullah Kurdi,9.4.2015  Abdullah Kurdi
1771,9.3.2015,Honk if you believe in Charlie #Stronghorns,9.3.2015  Honk if you believe in Charlie #Stronghorns
1772,9.2.2015,4 days left until Texas Football,9.2.2015  4 days left until Texas Football
1773,9.1.2015,You party,9.1.2015  You party
1774,8.31.2015,I can finally sleep again,8.31.2015  I can finally sleep again
1775,8.28.2015,Thoughts & prayers for those in Virginia,8.28.2015  Thoughts & prayers for those in Virginia
1776,8.26.2015,If stress burned calories I’d be a supermodel!,8.26.2015  If stress burned calories I’d be a supermodel!
1777,8.25.2015,Free margaritas for Stone Skarlatos & Sadler #America,8.25.2015  Free margaritas for Stone Skarlatos & Sadler #America
1778,8.24.2015,Back to school,8.24.2015  Back to school
1779,8.21.2015,Cheat on us with Ashley Madison? We don’t want to taco about it,8.21.2015  Cheat on us with Ashley Madison? We don’t want to taco about it
1780,8.20.2015,"Our phones fall, we panic.","8.20.2015  Our phones fall, we panic."
1781,8.19.2015,Why is Jon Stewart waiting to announce his presidential bid?,8.19.2015  Why is Jon Stewart waiting to announce his presidential bid?
1782,8.18.2015,Feel free to just a-row your way on over here,8.18.2015  Feel free to just a-row your way on over here
1783,8.17.2015,Life without Mexican food is like no life at all,8.17.2015  Life without Mexican food is like no life at all
1784,8.14.2015,I treid to mkea tihs sgin but the margs are too good,8.14.2015  I treid to mkea tihs sgin but the margs are too good
1785,8.13.2015,Our food may come out hot but I guarantee our ice comes out cold,8.13.2015  Our food may come out hot but I guarantee our ice comes out cold
1786,8.12.2015,Caution: Queso crossing,8.12.2015  Caution: Queso crossing
1787,8.11.2015,No checks,8.11.2015  No checks
1788,8.10.2015,Charlie Strong doesn’t sleep he just closes his eyes and waits,8.10.2015  Charlie Strong doesn’t sleep he just closes his eyes and waits
1789,8.7.2015,Kinda surprised that Trump didn’t invent the selfie stick,8.7.2015  Kinda surprised that Trump didn’t invent the selfie stick
1790,8.6.2015,Thanks to Facebook we know what everyone’s bathroom looks like,8.6.2015  Thanks to Facebook we know what everyone’s bathroom looks like
1791,8.5.2015,"Dear Karma, I have a list of people you missed","8.5.2015  Dear Karma, I have a list of people you missed"
1792,8.4.2015,Life is Short,8.4.2015  Life is Short
1793,8.3.2015,What’s Forrest Gump’s password? 1Forrest1,8.3.2015  What’s Forrest Gump’s password? 1Forrest1
1794,7.31.2015,"Hairstylist? No, my pillow gives me a new style every morning","7.31.2015  Hairstylist? No, my pillow gives me a new style every morning"
1795,7.30.2015,Never fight an ugly person they literally have nothing to lose,7.30.2015  Never fight an ugly person they literally have nothing to lose
1796,7.29.2015,Zimbabwe to start offering dentist hunts this fall,7.29.2015  Zimbabwe to start offering dentist hunts this fall
1797,7.28.2015,I pack an hour before leaving and unpack a month after I get back.,7.28.2015  I pack an hour before leaving and unpack a month after I get back.
1798,7.27.2015,Don’t ask questions you don’t want the answer to,7.27.2015  Don’t ask questions you don’t want the answer to
1799,7.24.2015,If you must be late be late with El Arroyo breakfast tacos,7.24.2015  If you must be late be late with El Arroyo breakfast tacos
1800,7.23.2015,Dryers must have a secret door for socks,7.23.2015  Dryers must have a secret door for socks
1801,7.22.2015,If you fall I’ll be there,7.22.2015  If you fall I’ll be there
1802,7.21.2015,I used to be indecisive but now I’m not so sure,7.21.2015  I used to be indecisive but now I’m not so sure
1803,7.20.2015,A yawn is a silent scream for coffee,7.20.2015  A yawn is a silent scream for coffee
1804,7.17.2015,Ditch and drive but don’t drink and drive,7.17.2015  Ditch and drive but don’t drink and drive
1805,7.16.2015,Aspire to inspire before you expire,7.16.2015  Aspire to inspire before you expire
1806,7.15.2015,When we spell a word wrong it’s always on porpoise,7.15.2015  When we spell a word wrong it’s always on porpoise
1807,7.14.2015,Come in American and leave Texan,7.14.2015  Come in American and leave Texan
1808,7.13.2015,It’s easier to kidnap skinny people so eat a taco,7.13.2015  It’s easier to kidnap skinny people so eat a taco
1809,7.10.2015,Honk if you believe Chupacabra is real,7.10.2015  Honk if you believe Chupacabra is real
1810,7.9.2015,Can a Google car sign up to be an Uber driver?,7.9.2015  Can a Google car sign up to be an Uber driver?
1811,7.8.2015,Puppies and tequila both make me 100X better to women,7.8.2015  Puppies and tequila both make me 100X better to women
1812,7.7.2015,Lake Travis waterfront property prices rising quickly,7.7.2015  Lake Travis waterfront property prices rising quickly
1813,7.6.2015,Japan wins hot dog contest,7.6.2015  Japan wins hot dog contest
1814,7.2.2015,Keep us on speed dial in queso emergency,7.2.2015  Keep us on speed dial in queso emergency
1815,7.1.2015,I dieted for a month and all I lost was 30 days,7.1.2015  I dieted for a month and all I lost was 30 days
1816,6.30.2015,Salsa on in for some chips and queso,6.30.2015  Salsa on in for some chips and queso
1817,6.29.2015,Not all dragons were meant to fly #goSpaceX,6.29.2015  Not all dragons were meant to fly #goSpaceX
1818,6.26.2015,The shin bone: A device for finding furniture in a dark room,6.26.2015  The shin bone: A device for finding furniture in a dark room
1819,6.25.2015,Now taking name suggestions for KimYae’s new baby boy,6.25.2015  Now taking name suggestions for KimYae’s new baby boy
1820,6.24.2015,Looks like Apple has some bad blood,6.24.2015  Looks like Apple has some bad blood
1821,6.23.2015,Stop reading this and keep driving,6.23.2015  Stop reading this and keep driving
1822,6.22.2015,"Brian Williams joining Sharpton on MSNBC, comedians rejoice","6.22.2015  Brian Williams joining Sharpton on MSNBC, comedians rejoice"
1823,6.19.2015,Chelsea Handler for the ten dollar bill,6.19.2015  Chelsea Handler for the ten dollar bill
1824,6.18.2015,If my memory was any worse I could plan my own surprise party,6.18.2015  If my memory was any worse I could plan my own surprise party
1825,6.17.2015,Does struggling to put on your jeans count as cardio?,6.17.2015  Does struggling to put on your jeans count as cardio?
1826,6.16.2015,I wish they had kiss cams at the DMV #worththewait,6.16.2015  I wish they had kiss cams at the DMV #worththewait
1827,6.15.2015,Farm to fryer #stillthebest,6.15.2015  Farm to fryer #stillthebest
1828,6.12.2015,Want to live forever? Hire a project manager to plan your death,6.12.2015  Want to live forever? Hire a project manager to plan your death
1829,6.11.2015,Hey mold you’re getting really really old,6.11.2015  Hey mold you’re getting really really old
1830,6.10.2015,"Dear Blue Bell,","6.10.2015  Dear Blue Bell,"
1831,6.9.2015,Due to rising temps we will not accept boob or sock money,6.9.2015  Due to rising temps we will not accept boob or sock money
1832,6.8.2015,Didn’t anyone remind those birds to get their flu shot?,6.8.2015  Didn’t anyone remind those birds to get their flu shot?
1833,6.5.2015,World Cup Austin: Free enchiladas for FIFA executives,6.5.2015  World Cup Austin: Free enchiladas for FIFA executives
1834,6.4.2015,Let the games begin #WarriorsvsCavs,6.4.2015  Let the games begin #WarriorsvsCavs
1835,6.3.2015,Who says nothing is impossible? I’ve been doing it for years,6.3.2015  Who says nothing is impossible? I’ve been doing it for years
1836,6.2.2015,Sleeping is like a time machine to breakfast,6.2.2015  Sleeping is like a time machine to breakfast
1837,6.1.2015,Every rain dance should be followed by a rain bow,6.1.2015  Every rain dance should be followed by a rain bow
1838,5.29.2015,Why do we bake cookies and cook bacon?,5.29.2015  Why do we bake cookies and cook bacon?
1839,5.28.2015,"I stepped on a cornflake, now I’m a cereal killer","5.28.2015  I stepped on a cornflake, now I’m a cereal killer"
1840,5.27.2015,Our prayers go out to all of the flood victims and their families,5.27.2015  Our prayers go out to all of the flood victims and their families
1841,5.26.2015,"Closed til 4 PM due to storm. See you tonight, normal hours tomorrow","5.26.2015  Closed til 4 PM due to storm. See you tonight, normal hours tomorrow"
1842,5.22.2015,Better days are coming: Saturday and Sunday,5.22.2015  Better days are coming: Saturday and Sunday
1843,5.21.2015,Do you hear that? It’s the sound of mosquitoes mating!,5.21.2015  Do you hear that? It’s the sound of mosquitoes mating!
1844,5.20.2015,"Education is important, but beer is importanter","5.20.2015  Education is important, but beer is importanter"
1845,5.19.2015,"If the opposite of pro is con, is the opposite of progress Congress?","5.19.2015  If the opposite of pro is con, is the opposite of progress Congress?"
1846,5.18.2015,Cat puns freak meowt,5.18.2015  Cat puns freak meowt
1847,5.15.2015,Keep calm and do a kickflip #XGamesAustin,5.15.2015  Keep calm and do a kickflip #XGamesAustin
1848,5.14.2015,ATX is getting a bowl game? It can only be one thing: the queso bowl,5.14.2015  ATX is getting a bowl game? It can only be one thing: the queso bowl
1849,5.13.2015,Kim Kardashian publishes a sequel: Too Selfish,5.13.2015  Kim Kardashian publishes a sequel: Too Selfish
1850,5.12.2015,It’s almost too humid to sleep naked,5.12.2015  It’s almost too humid to sleep naked
1851,5.11.2015,You can bring your chihuawa to El Arroyo – there are no bears here,5.11.2015  You can bring your chihuawa to El Arroyo – there are no bears here
1852,5.8.2015,Follow us on instagram @el_arroyo_sin,5.8.2015  Follow us on instagram @el_arroyo_sin
1853,5.7.2015,5th Street Commons: Only where awesome people live,5.7.2015  5th Street Commons: Only where awesome people live
1854,5.6.2015,The only downside to Cinco de Mayo is Seis de Hangover,5.6.2015  The only downside to Cinco de Mayo is Seis de Hangover
1855,5.5.2015,May the fifth be with you. Happy Cinco de Mayo,5.5.2015  May the fifth be with you. Happy Cinco de Mayo
1856,5.4.2015,"Those that know do, those that understand teach","5.4.2015  Those that know do, those that understand teach"
1857,5.1.2015,Congrats Seniors,5.1.2015  Congrats Seniors
1858,4.30.2015,Two rules to success: Never reveal everything you know,4.30.2015  Two rules to success: Never reveal everything you know
1859,4.29.2015,"Dear Baltimore Mom,","4.29.2015  Dear Baltimore Mom,"
1860,4.28.2015,The clear history button has saved more lives than Superman,4.28.2015  The clear history button has saved more lives than Superman
1861,4.27.2015,You don’t have to be happy to come to happy hour but it’s preferred,4.27.2015  You don’t have to be happy to come to happy hour but it’s preferred
1862,4.24.2015,The bottles are dressed up so you can get dressed down,4.24.2015  The bottles are dressed up so you can get dressed down
1863,4.23.2015,"Unless you fell on the treadmill, no one wants to hear about your workout","4.23.2015  Unless you fell on the treadmill, no one wants to hear about your workout"
1864,4.22.2015,Keep the Earth clean it isn’t Uranus,4.22.2015  Keep the Earth clean it isn’t Uranus
1865,4.21.2015,I swipe right for queso,4.21.2015  I swipe right for queso
1866,4.20.2015,Soup of the day: Tequila,4.20.2015  Soup of the day: Tequila
1867,4.17.2015,If only it would rain margaritas then we wouldn’t need our umbrella,4.17.2015  If only it would rain margaritas then we wouldn’t need our umbrella
1868,4.16.2015,Coach Pop is so smart he wins Connect Four in only three moves,4.16.2015  Coach Pop is so smart he wins Connect Four in only three moves
1869,4.15.2015,The Apple Watch has fallen far from the tree,4.15.2015  The Apple Watch has fallen far from the tree
1870,4.14.2015,Don’t forget to file an extension on your taxes,4.14.2015  Don’t forget to file an extension on your taxes
1871,4.13.2015,Congrats Jordan on turning the green jacket burnt orange,4.13.2015  Congrats Jordan on turning the green jacket burnt orange
1872,4.10.2015,"Hi my name is Austin, Texas and I’m addicted to tinder","4.10.2015  Hi my name is Austin, Texas and I’m addicted to tinder"
1873,4.9.2015,Shouldn’t cookies be called bakies?,4.9.2015  Shouldn’t cookies be called bakies?
1874,4.8.2015,If you don’t pay your exorcist do you get repossessed?,4.8.2015  If you don’t pay your exorcist do you get repossessed?
1875,4.7.2015,If a turtle loses its shell is it naked or homeless?,4.7.2015  If a turtle loses its shell is it naked or homeless?
1876,4.6.2015,Is there anything more painful than stepping on a Lego?,4.6.2015  Is there anything more painful than stepping on a Lego?
1877,4.2.2015,I decide which beer to drink on a case by case basis,4.2.2015  I decide which beer to drink on a case by case basis
1878,4.1.2015,"Remember today: Believe nothing, trust no one","4.1.2015  Remember today: Believe nothing, trust no one"
1879,3.31.2015,"Dear vegans,","3.31.2015  Dear vegans,"
1880,3.30.2015,IF it wasn’t for sarcasm I’d never have anything nice to say,3.30.2015  IF it wasn’t for sarcasm I’d never have anything nice to say
1881,3.27.2015,This sign is gluten free,3.27.2015  This sign is gluten free
1882,3.26.2015,Happy Prince Jonah Kuhio Kalanianaole Day,3.26.2015  Happy Prince Jonah Kuhio Kalanianaole Day
1883,3.25.2015,The truth is out there,3.25.2015  The truth is out there
1884,3.24.2015,Finally spring? We got so excited we wet our pants,3.24.2015  Finally spring? We got so excited we wet our pants
1885,3.23.2015,Nothing says “I mean business” like using a cart at a liquor store,3.23.2015  Nothing says “I mean business” like using a cart at a liquor store
1886,3.20.2015,"Happy spring, or as I like to say it: Sneezin’s Greetings","3.20.2015  Happy spring, or as I like to say it: Sneezin’s Greetings"
1887,3.19.2015,I need a 6 month vacation twice a year,3.19.2015  I need a 6 month vacation twice a year
1888,3.18.2015,"It’s not a hangover, it’s the beer flu","3.18.2015  It’s not a hangover, it’s the beer flu"
1889,3.17.2015,Take a pitcher it will last longer,3.17.2015  Take a pitcher it will last longer
1890,3.16.2015,"You can’t get a case of the Mondays, we’re all out of stock","3.16.2015  You can’t get a case of the Mondays, we’re all out of stock"
1891,3.12.2015,Spring needs to stand up to winter and kick it in the snowballs,3.12.2015  Spring needs to stand up to winter and kick it in the snowballs
1892,3.11.2015,"Respect your parents, they passed high school without Google","3.11.2015  Respect your parents, they passed high school without Google"
1893,3.10.2015,Nothing moves faster than a girl untagging herself from a bad photo,3.10.2015  Nothing moves faster than a girl untagging herself from a bad photo
1894,3.9.2015,I can rise and shine just not at the same time,3.9.2015  I can rise and shine just not at the same time
1895,3.6.2015,Employee Appreciation Day – AKA show me the money,3.6.2015  Employee Appreciation Day – AKA show me the money
1896,3.5.2015,Mars in 2025? Wonder if they’ll have queso #dealbreaker,3.5.2015  Mars in 2025? Wonder if they’ll have queso #dealbreaker
1897,3.4.2015,White and gold? Blue and black? I just want my newsfeed back,3.4.2015  White and gold? Blue and black? I just want my newsfeed back
1898,3.3.2015,"Tex Mex funk you up, Tex Mex funk you up","3.3.2015  Tex Mex funk you up, Tex Mex funk you up"
1899,3.2.2015,Let’s celebrate Texas independence from Mexico by drinking margaritas,3.2.2015  Let’s celebrate Texas independence from Mexico by drinking margaritas
1900,2.27.2015,I’m giving up drinking for lent and lent for St. Patrick’s Day,2.27.2015  I’m giving up drinking for lent and lent for St. Patrick’s Day
1901,2.26.2015,I use El Arroyo signs as pick up lines #whyI’msingle,2.26.2015  I use El Arroyo signs as pick up lines #whyI’msingle
1902,2.25.2015,RIP Sgt. Aycock,2.25.2015  RIP Sgt. Aycock
1903,2.24.2015,Sign canceled due to the cold,2.24.2015  Sign canceled due to the cold
1904,2.23.2015,Whatever happened to The Dixie Chicks? They all get pregnant?,2.23.2015  Whatever happened to The Dixie Chicks? They all get pregnant?
1905,2.20.2015,In a ditch? Better call Saul,2.20.2015  In a ditch? Better call Saul
1906,2.19.2015,"If Britney Spears can get through 2007, you can get through today","2.19.2015  If Britney Spears can get through 2007, you can get through today"
1907,2.18.2015,Do you think butterflies get tattoo’s of girls?,2.18.2015  Do you think butterflies get tattoo’s of girls?
1908,2.17.2015,This sign was created by Brian Williams,2.17.2015  This sign was created by Brian Williams
1909,2.16.2015,"Accomplishment will prove to be a journey, not a destination","2.16.2015  Accomplishment will prove to be a journey, not a destination"
1910,2.13.2015,Hope you’re not spending Valentines Day with your X … Box,2.13.2015  Hope you’re not spending Valentines Day with your X … Box
1911,2.12.2015,"Unlike Tiger, our bartenders can actually make a shot","2.12.2015  Unlike Tiger, our bartenders can actually make a shot"
1912,2.11.2015,"Measles, the worst breakout since the Backstreet Boys","2.11.2015  Measles, the worst breakout since the Backstreet Boys"
1913,2.10.2015,"Now serving jackamole, someone please tell Mr. White","2.10.2015  Now serving jackamole, someone please tell Mr. White"
1914,2.9.2015,Four five seconds to figure out why Paul was involved with that song,2.9.2015  Four five seconds to figure out why Paul was involved with that song
1915,2.6.2015,Less work more ritas #meaningoflife,2.6.2015  Less work more ritas #meaningoflife
1916,2.5.2015,My fake plants died because I forgot to pretend to water them,2.5.2015  My fake plants died because I forgot to pretend to water them
1917,2.4.2015,Dear white crayon: Explain yourself,2.4.2015  Dear white crayon: Explain yourself
1918,2.3.2015,Is it a coincidence that morning and mourning sound the same?,2.3.2015  Is it a coincidence that morning and mourning sound the same?
1919,2.2.2015,Carrying all the groceries in one trip #winning,2.2.2015  Carrying all the groceries in one trip #winning
1920,1.30.2015,Is it still “diet” coke if you drink five of them?,1.30.2015  Is it still “diet” coke if you drink five of them?
1921,1.29.2015,Big game got you stressed? Pick up El Arroyo for less mess!,1.29.2015  Big game got you stressed? Pick up El Arroyo for less mess!
1922,1.28.2015,"We’ll make you breakfast in bed, just don’t ask how we got in","1.28.2015  We’ll make you breakfast in bed, just don’t ask how we got in"
1923,1.27.2015,I just started a second diet,1.27.2015  I just started a second diet
1924,1.26.2015,Bobby Pins: How females mark their territory,1.26.2015  Bobby Pins: How females mark their territory
1925,1.23.2015,Writer’s Block: When the imaginary people in your head won’t talk to you,1.23.2015  Writer’s Block: When the imaginary people in your head won’t talk to you
1926,1.22.2015,Come to El Arroyo where the gas is free,1.22.2015  Come to El Arroyo where the gas is free
1927,1.21.2015,Don’t grow up it’s a trap,1.21.2015  Don’t grow up it’s a trap
1928,1.20.2015,"Hey kids, pizza is bad for you so eat queso","1.20.2015  Hey kids, pizza is bad for you so eat queso"
1929,1.19.2015,“What are you doing for others?”,1.19.2015  “What are you doing for others?”
1930,1.16.2015,What do you call a cow with a twitch? Beef jerky,1.16.2015  What do you call a cow with a twitch? Beef jerky
1931,1.15.2015,Who is my favorite band you ask? Juan Direction of course!,1.15.2015  Who is my favorite band you ask? Juan Direction of course!
1932,1.14.2015,Sometimes the smallest typo can charge everything!,1.14.2015  Sometimes the smallest typo can charge everything!
1933,1.13.2015,Don’t worry our burritos aren’t photoshopped,1.13.2015  Don’t worry our burritos aren’t photoshopped
1934,1.12.2015,Breakfast anytime? I’ll have an omelet in 1846,1.12.2015  Breakfast anytime? I’ll have an omelet in 1846
1935,1.9.2015,There is no great genius without madness,1.9.2015  There is no great genius without madness
1936,1.8.2015,My weight is perfect it is my height that’s the problem,1.8.2015  My weight is perfect it is my height that’s the problem
1937,1.7.2015,After you give up the New Year’s diet get some queso!,1.7.2015  After you give up the New Year’s diet get some queso!
1938,1.6.2015,Men have dirty thoughts every four to sex seconds,1.6.2015  Men have dirty thoughts every four to sex seconds
1939,1.5.2015,"“Everyday ask yourself, ‘Am I fighting for my dreams?'”","1.5.2015  “Everyday ask yourself, ‘Am I fighting for my dreams?'”"
1940,1.2.2015,Make a pit stop here before going to “the gym”,1.2.2015  Make a pit stop here before going to “the gym”
1941,12.31.2014,Less than 24 hus to do all the things you resolve to not do tomorrow,12.31.2014  Less than 24 hus to do all the things you resolve to not do tomorrow
1942,12.30.2014,Don’t hog the nog,12.30.2014  Don’t hog the nog
1943,12.29.2014,"I say no to ritas, they just don’t listen","12.29.2014  I say no to ritas, they just don’t listen"
1944,12.24.2014,Every time a bell rings we make another rita,12.24.2014  Every time a bell rings we make another rita
1945,12.23.2014,The tree isn’t the only thing getting lit this Christmas!,12.23.2014  The tree isn’t the only thing getting lit this Christmas!
1946,12.22.2014,Will someone please send us a Christmas gram?,12.22.2014  Will someone please send us a Christmas gram?
1947,12.19.2014,"Dear week,","12.19.2014  Dear week,"
1948,12.18.2014,"Santa baby, put a rita under the tree … for me","12.18.2014  Santa baby, put a rita under the tree … for me"
1949,12.17.2014,What do you call those who are scared of Santa? Claustraphobic,12.17.2014  What do you call those who are scared of Santa? Claustraphobic
1950,12.16.2014,Tis the season to be jolly and adopt a cat or doggy,12.16.2014  Tis the season to be jolly and adopt a cat or doggy
1951,12.15.2014,What does a nosy pepper do? Get jalapeno business!,12.15.2014  What does a nosy pepper do? Get jalapeno business!
1952,12.12.2014,"Dear inventor of happy hour,","12.12.2014  Dear inventor of happy hour,"
1953,12.11.2014,"Margaritas, life’s little way of saying thanks!","12.11.2014  Margaritas, life’s little way of saying thanks!"
1954,12.10.2014,"Congrats, Trail of Lights on your 50th Anniversary!","12.10.2014  Congrats, Trail of Lights on your 50th Anniversary!"
1955,12.9.2014,Why do people say “No offense” when they’re about to offend you?,12.9.2014  Why do people say “No offense” when they’re about to offend you?
1956,12.8.2014,"I wrote a song about a tortilla. Actually, it’s more like a wrap","12.8.2014  I wrote a song about a tortilla. Actually, it’s more like a wrap"
1957,12.5.2014,It’s beginning to cost a lot like Christmas.,12.5.2014  It’s beginning to cost a lot like Christmas.
1958,12.4.2014,What happens when you cross a snowman and vampire? Frostbite,12.4.2014  What happens when you cross a snowman and vampire? Frostbite
1959,12.3.2014,What do snowmen eat for breakfast? Snowflakes,12.3.2014  What do snowmen eat for breakfast? Snowflakes
1960,12.2.2014,"Dear Santa, I can explain","12.2.2014  Dear Santa, I can explain"
1961,12.1.2014,Do you think Santa gets tired of delivering black yoga pants?,12.1.2014  Do you think Santa gets tired of delivering black yoga pants?
1962,11.26.2014,Don’t forget to set your scale back 10 pounds tonight.,11.26.2014  Don’t forget to set your scale back 10 pounds tonight.
1963,11.25.2014,Why didn’t the turkey want seconds? He was stuffed,11.25.2014  Why didn’t the turkey want seconds? He was stuffed
1964,11.24.2014,How did Einstein celebrate Thanksgiving? He was thinkfull,11.24.2014  How did Einstein celebrate Thanksgiving? He was thinkfull
1965,11.21.2014,Stressed is desserts spelled backwards,11.21.2014  Stressed is desserts spelled backwards
1966,11.20.2014,"Take life with a grain of salt a salt, a slice of lime & a shot of tequila!","11.20.2014  Take life with a grain of salt a salt, a slice of lime & a shot of tequila!"
1967,11.19.2014,We can help you achieve the perfect winter body!,11.19.2014  We can help you achieve the perfect winter body!
1968,11.18.2014,Sweet dreams are made of cheese,11.18.2014  Sweet dreams are made of cheese
1969,11.17.2014,Exaggeration went up by a million percent last year,11.17.2014  Exaggeration went up by a million percent last year
1970,11.14.2014,What did the hat say to the scarf?,11.14.2014  What did the hat say to the scarf?
1971,11.13.2014,"Iphones, peer pressure for adults!","11.13.2014  Iphones, peer pressure for adults!"
1972,11.12.2014,"Volunteer at the animal shelter, puppies & kittens need hugs too!","11.12.2014  Volunteer at the animal shelter, puppies & kittens need hugs too!"
1973,11.11.2014,Freedom is never free,11.11.2014  Freedom is never free
